CONTEXT,SENTENCE,GENDER of REFERENT,BENCHMARK TRANSLATION,GOOGLE TRANSLATION,REF2,CORRESPONDENCE,,LINK ORIGINALI
"As Director of Construction at the Olympic Delivery Authority he was paid £285,000 - £289,999 Per Annum.[citation needed] Shiplee was appointed Commander of the Order of the British Empire (CBE) in the 2012 New Year Honours for services to construction. <sep> ",Shiplee is a former director of specialist construction consultancy High Point Rendel.,M,"Shiplee è l'ex direttore dell'agenzia di consulenza High Point Rendel, che opera nel settore delle costruzioni.",Shiplee è un ex direttore della società di consulenza specializzata in costruzioni High Point Rendel.,M,Y,,
"He completed his doctoral programme in Islamic art at the University of Tokyo in 1976, and was research fellow at the Royal Academy of Iran until the Islamic Revolution in 1979. <sep> ",Igarashi was an associate professor of comparative Islamic culture at the University of Tsukuba.,M,Igarashi era un professore associato di cultura islamica comparata presso l'universitòà di Tsukuba.,Igarashi era professore associato di cultura islamica comparata all'Università di Tsukuba.,M,Y,,
"In his 1913 thesis, he derived the Fokker–Planck equation along with Max Planck. <sep> ",Fokker became a physics teacher at the Gymnasium of Delft after 1918 and was appointed in 1923 as the first professor of Applied Physics at the Technische Hoogeschool Delft (today Delft University of Technology).,M,Fokker divenne un professore di fisica al Gymnasium di Delf dopo il 1918 e fu incaricato nel 1923 come primo professore di fisica applicata presso la Technische Hoogeschool Delft (oggi conosciuta come Delft University of Technology).,Fokker divenne insegnante di fisica al Gymnasium di Delft dopo il 1918 e fu nominato nel 1923 primo professore di fisica applicata alla Technische Hoogeschool Delft (oggi Delft University of Technology).,M,Y,,
"A woman arrives in Guernsey, with her son Gilliat, and buys a house said to be haunted. <sep> ",Gilliat becomes a good fisherman and sailor.,M,Gilliat diventa un bravo pescatore e marinaio.,Gilliat diventa un buon pescatore e marinaio.,M,Y,,
"During his studies in Yale, Gager was a Freedom Rider, and was arrested in Jackson, Mississippi in June 1961. <sep> ","Professor Gager is also an avid rock climber, kayaker, and cyclist.",M,"Il professor Gager è anche un fervente appassionato di arrampicata su roccia, kayak e ciclismo.","Il professor Gager è anche un appassionato scalatore, kayaker e ciclista.",M,Y,,
James Boswell described Dundas as a comely jovial Scotch gentleman of good address but not bright parts ... <sep> ,Dundas was a great collector of art.,M,Dundas fu un grande collezionista d'arte.,Dundas era un grande collezionista d'arte.,M,Y,,
"USS Washakie, a United States Navy harbor tug in service from 1944 to 1946 and from 1953 to 1975, also was named for him. <sep> ",Washakie was a hide painter.,M,Washakie era un pittore di pelli.,Washakie era un pittore di pelli.,M,Y,,
Here the Duke is suffering from money worries as Cornwell states he knew that money kept an army efficient. <sep> ,"The books tells a fictionalised account of the destruction of Almeida which, as Cornwell notes conveniently for a writer of fiction, remains a mystery.",M,"I libri raccontano in modo romanzato della distruzione di Almeida che, come nota Cornwell covenientemente in quanto scrittore di narrativa, rimane un mistero.","I libri raccontano un resoconto romanzato della distruzione di Almeida che, come nota convenientemente Cornwell per uno scrittore di narrativa, rimane un mistero.",M,Y,,
"Higgins was born in Boston, Massachusetts, where he attended the public schools and graduated from Harvard University in 1917. <sep> ","Returning to civilian life, Higgins was employed as a chemist from 1919 until 1922.",M,"Una volta fatto ritorno alla vita civile, Higgins lavorò come chimico dal 1919 al 1922.","Tornato alla vita civile, Higgins fu impiegato come chimico dal 1919 al 1922.",M,Y,,
"A widely believed story, summarized in an article by columnist Tracy Ringolsby, holds that a hospitalized writer from Philadelphia had turned in a ballot with Campanella listed as his first-place and fifth-place vote. <sep> ",It was assumed that the writer had meant to write Snider's name into one of those slots.,M,Si riteneva che lo scrittore volesse scrivere il nome di Snider in uno di quei slot.,Si presumeva che lo scrittore avesse intenzione di scrivere il nome di Snider in una di quelle fessure.,M,Y,,
"One of the conference delegates, Professor Alfred T. Halsted, loved the game of Mintonette, but he felt like something was just not right. <sep> ","Professor Halsted suggested that the name of the game should be Volleyball, since the main point of the game was to “volley” the ball to a player or over the net.",M,"Il professor Halsted suggerì che il gioco dovesse chiamarsi pallavolo, dato che lo scopo principale era far volare la palla verso un compagno oppure oltre la rete.","Il professor Halsted ha suggerito che il nome del gioco dovrebbe essere Volleyball, poiché lo scopo principale del gioco era ""tirare al volo"" la palla verso un giocatore o sopra la rete.",M,Y,,
"Second, the jury's role was only advisory; the judge could disregard the jury's sentencing recommendation, but had to explain his reasoning if he did. <sep> ",The trial judge must independently reweigh the aggravating factors against the mitigating factors.,M,Il giudice del processo deve soppesare nuovamente e in modo indipendente le aggravanti e le attenuanti.,Il giudice del processo deve valutare autonomamente le aggravanti rispetto alle attenuanti.,M,Y,,
"He finished his international career as Australia's most capped player, with a total of 39 caps (36 Test and 3 World Cup), a record that remained until Mal Meninga broke it in 1992. <sep> ","After retiring from the playing field in 1967, Gasnier was involved in the media side of rugby league, becoming a sports writer and broadcaster.",M,"Dopo essersi ritirato dal campo giocato nel 1967, Gasnier fu coinvolto nella parte mediatica della lega rugby, diventando uno scrittore sportivo e broadcaster.","Dopo essersi ritirato dal campo di gioco nel 1967, Gasnier è stato coinvolto nella parte mediatica del rugby league, diventando scrittore ed emittente sportiva.",M,Y,,
"In October 2001, Gooch returned to his beloved Essex in the capacity of head coach, taking over from Keith Fletcher. <sep> ","Gooch remains at the club, continuing as the squad's specialist batting coach whilst also assuming commercial duties for the county.",M,"Gooch rimane al club, continuando come allenatore di battuta specialista della squadra ed ha assunto impegni commerciali per la contea.","Gooch rimane al club, continuando come allenatore specializzato in battuta della squadra e assumendo anche compiti commerciali per la contea.",M,Y,,
Rall interned at Bellevue Hospital in New York City from 1952 – 1953 when he joined the National Cancer Institute in 1954. <sep> ,"Rall also served as a surgeon (1955–1959), a senior surgeon (1959–1960), medical director (1963–1971), and assistant surgeon general (1971–1990) in the United States Public Health Services.",M,"Rall fu anche chirurgo (1955-9), primario di chirurgia (1959-60), direttore sanitario (1963-71) e ispettore sanitario (1971-90) del Servizio Sanitario Nazionale statunitense.","Rall è stato anche chirurgo (1955–1959), chirurgo senior (1959–1960), direttore medico (1963–1971) e assistente chirurgo generale (1971–1990) nei servizi sanitari pubblici degli Stati Uniti.",M,Y,,
"He taught mathematics there when he graduated, then at the Georgia Military Institute in 1885–1886, as well as a 2-year stint teaching at South Georgia College in Thomasville. <sep> ",Snelling came to the university in 1888 as an adjunct professor of mathematics and commandant of cadets.,M,Snelling arrivò nell'ateneo nel 1888 come professore aggiunto di matematica e comandante dei cadetti.,Snelling arrivò all'università nel 1888 come professore a contratto di matematica e comandante dei cadetti.,M,Y,,
"When the symbiote breaks into the facility, the doctor offers himself to the creature, but it rejects him and returns to Kasady after resuscitating him. <sep> ","Carnage proceeds to asphyxiate the doctor, rampage through the prison, and escape.",M,"Carnage procede con l'asfissiare il dottore, scatenarsi in prigione e scappare.","Carnage procede ad asfissiare il dottore, si scatena nella prigione e scappa.",M,Y,,
"Carlos Catasse (1944 – January 19, 2010), born Carlos Tapia Sepúlveda in Santiago, Chile, formed his new last name by combining the first two letters of his first, middle and last names. <sep> ",Catasse is a Chilean painter of international recognition.,M,Catasse è un pittore cileno di fama internazionale.,Catasse è un pittore cileno di fama internazionale.,M,Y,,
"Of his mother, Eulenburg wrote: My mother, whom I deeply adored, the ideal figure who filled my whole being with boundless love, fired my inspiration. <sep> ","Keenly interested in music, Eulenburg enjoyed considerable success as a writer of ballads.",M,"Keenly era interessato nella musica, Eulenburg godette di un successo considerevole come scrittore di ballate.","Vivamente interessato alla musica, Eulenburg ebbe un notevole successo come scrittore di ballate.",M,Y,,
"Executive producer, David Abramowitz, met Peter Wingfield at a Highlander convention in November 1999 and offered him the parts of Doctor Helm or Captain Grisham. <sep> ",Wingfield chose the doctor as a part with more mileage and more challenging.,M,Wingfield ha scelto la parte del dottore perché più longeva e stimolante.,Wingfield ha scelto il dottore come parte con più chilometraggio e più impegnativo.,M,Y,,
"He gained notoriety in his early twenties with the publication of his novels, Glamourpuss and Sex Toys of the Gods. <sep> ",McLaughlin worked as a script writer on:,M,McLaughlin lavorò come scrittore di bozze per:,McLaughlin ha lavorato come sceneggiatore in:,M,Y,,
"In December 1903 he passed the Civil Service Examination, and embarked on the career that led to the claim that he may be regarded as one of the greatest public servants of his day. <sep> ",Gowers entered the home civil service as an upper division clerk in the Department of Inland Revenue.,M,Gowers entrò nel servizio civile domestico come un addetto della divisione superiore nel Dipartimento delle Entrate Interne.,Gowers è entrato nel servizio civile domestico come impiegato della divisione superiore presso il Dipartimento delle entrate.,M,Y,,
"In 1971, Cleaver was hired as an assistant professor at the Université de Sherbrooke in Montreal, Quebec where he taught for three years, finished his dissertation, and studied Québécois nationalism. <sep> ","From 1974 to 1976, Cleaver was a visiting assistant professor at the New School for Social Research in the department of economics.",M,"Dal 1974 al 1976, Claver fu assistente professore in visita alla New School for Social Research nel dipartimento di economia.","Dal 1974 al 1976, Cleaver è stato visiting assistant professor presso la New School for Social Research nel dipartimento di economia.",M,Y,,
"Prior to joining the Sports Xchange, he wrote for ESPN.com starting in 2001 and was a frequent contributor to the other ESPN outlets, including SportsCenter, ESPNEWS, ESPN Radio and ESPN The Magazine. <sep> ","Before ESPN, Pasquarelli served as a senior writer for CBS SportsLine.com.",M,"Prima di ESPN, Pasquarelli ha lavorato come autore senior per CBS SportsLine.com.","Prima di ESPN, Pasquarelli ha lavorato come scrittore senior per CBS SportsLine.com.",M,Y,,
All agencies found his comments were not substantiated with factual data and his motivation was due to his upcoming termination. <sep> ,TEA found the CFO had incorrectly used federal funds.,M,La TEA riscontrò che il direttore finanziario aveva fatto un uso improprio di fondi federali.,TEA ha scoperto che il CFO aveva utilizzato in modo errato i fondi federali.,M,Y,,
"In 1919, the Laboratory became a part of the Warsaw University of Technology, where, as a professor, Miklaszewski worked until the end of his life. <sep> ","Professor Miklaszewski was very active in the scientific, didactic, organizational and publishing fields.",M,"Il professor Miklaszewski era molto attivo in campi come quello scientifico, didattico, organizzativo ed editoriale.","Il professor Miklaszewski è stato molto attivo in campo scientifico, didattico, organizzativo ed editoriale.",M,Y,,
"He was one of five siblings who survived to adulthood; his younger brother, Martin, became a major executive at Sam's companies. <sep> ",Insull's career began as an apprentice clerk for various local businesses at age 14.,M,La carriera di Insull cominciò come apprendista addetto per diverse aziende locali a 14 anni.,La carriera di Insull è iniziata come apprendista impiegato per varie aziende locali all'età di 14 anni.,M,Y,,
"H. the Prince of Wales visit in 1875–6, from William S. Potter to his sister, one could make a stronger case for Potter, as there are similarities in writing style between the book of letters and The Romance of Lust. <sep> ",Ashbee asserts that Potter acted as editor to contributions by a number of aficionados.,M,Ashbee afferma che Potter ha lavorato come redattore di contributi da parte di molti affezionati.,Ashbee afferma che Potter ha agito come editore dei contributi di un certo numero di appassionati.,M,Y,,
"His acting career began with the leading role in Vzlyot (Take-Off, 1979) by director Savva Kulish, where he played the leading role as Russian rocket scientist Konstantin Tsiolkovsky. <sep> ",Yevtushenko also made two films as a writer/director.,M,Yevtushenko ha anche realizzato due film come sceneggiatore/regista.,Yevtushenko ha anche realizzato due film come sceneggiatore/regista.,M,Y,,
"Because that second position was up field from the point where the line judge had positioned himself when Wycheck had thrown the ball, the line judge's hand signaled during the play that the pass was indeed a lateral and not an illegal forward pass. <sep> ","After a long official review, the video was deemed inconclusive to overturn the line judge's ruling on the field.",M,"Dopo una lunga revisione ufficiale, il video fu considerato inconcludente per ribaltare la decisione sul campo del giudice di linea.","Dopo una lunga revisione ufficiale, il video è stato ritenuto inconcludente per ribaltare la decisione del giudice di linea sul campo.",M,Y,,
"He became seriously ill and moved to Verona, where he died. <sep> ",Cantarini was principally a painter of the Counterreformation who painted religious subjects.,M,Cantarini era principalmente un pittore della controriforma che dipinse soggetti religiosi.,Cantarini fu principalmente un pittore della Controriforma che dipinse soggetti religiosi.,M,Y,,
"Mundine has had a stormy relationship with the media: his conversion to Islam in 1999, self-promotion and outspoken opinions have created a love–hate relationship with the Australian public. <sep> ",Mundine has been described as the most polarising athlete in Australian sports history.,M,Mundine è stato definito come l'atleta più polarizzante della storia sportiva australiana.,Mundine è stato descritto come l'atleta più polarizzante nella storia dello sport australiano.,M,Y,,
Astruc Remoch (sometimes spelled Raimuch) was a Jewish convert to Catholicism who made his mark in history by attempting the conversion of other Jews during the 14th century. <sep> ,"Remoch was a medical doctor in Fraga, Spain in the 14th century.",M,"Remoch fu un dottore a Fraga, in Spagna, nel XIV secolo.","Remoch era un medico a Fraga, in Spagna, nel XIV secolo.",M,Y,,
"However, this particular group of gay men drank significantly more than the rest of the group and eventually began to exhibit a loud, rowdy, and vulgar brand of behavior that made the straight men uncomfortable. <sep> ","The problem came to a head when a gay instructor attempted suicide by overdosing on APC (aspirin, phenacetin, and caffeine) tablets after being spurned by another soldier.",M,"Il problema venne a galla quando un istruttore omosessuale tentò il suicidio tramite overdose di compresse APC (aspirina, fenacetina e caffeina) dopo essere stato respinto da un altro soldato.","Il problema è arrivato al culmine quando un istruttore gay ha tentato il suicidio con un'overdose di compresse di APC (aspirina, fenacetina e caffeina) dopo essere stato respinto da un altro soldato.",M,Y,,
"He received his medical education at the College of Physicians and Surgeons of the Western District of New York in Fairfield, New York. <sep> ","As well as being resident physician at two hospitals, Gorrie was active in the community.",M,"Oltre ad essere dottore residente in due ospedali, Gorrie fu attivo nella comunità.","Oltre ad essere medico residente in due ospedali, Gorrie era attivo nella comunità.",M,Y,,
"There is a memorial to him inside the church, with an epitaph written by his friend, William Wordsworth. <sep> ","Southey was also a prolific letter writer, literary scholar, essay writer, historian and biographer.",M,"Southey fu anche un prolifico scrittore di lettere, studioso di letteratura, scrittore di saggi, storico e biografo.","Southey è stato anche un prolifico scrittore di lettere, studioso di letteratura, saggista, storico e biografo.",M,Y,,
He began his campaign in late 1823 and faced little opposition until Christopher Tompkins declared his candidacy in May 1824. <sep> ,Tompkins was a little-known judge from Bourbon County who vehemently held to the principles of the Anti-Relief faction.,M,Tompkins era un giudice poco conosciuto di Bourbon county che veementemente rimase fedele ai principi del partito anti-condono.,Tompkins era un giudice poco conosciuto della contea di Bourbon che si atteneva con veemenza ai principi della fazione antisollievo.,M,Y,,
Upon his resignation from the Center for Inquiry he launched the Institute for Science and Human Values as a separate entity. <sep> ,"Kurtz was editor-in-chief of ISHV's journal, The Human Prospect: A NeoHumanist Perspective.",M,"Kurtz fu caporedatore del giornale ISHV, The Human Prospect: A NeoHumanist Perspective.","Kurtz è stato redattore capo della rivista di ISHV, The Human Prospect: A NeoHumanist Perspective.",M,Y,,
From 1994 to 1996 he was assistant at the Department of Indology and Religious Studies at the University of Tübingen. 1995 followed the habilitation in the field of religious studies and Greek philology. <sep> ,"Since 2001, Auffarth has been Full Professor of Religious Studies with a focus on History and Theologies of Christianity at the University of Bremen.",M,"Dal 2001, Auffarth ha detenuto la cattedra di Professore di Studi Religiosi con focus sulla Storia e Teologie Cristiane presso l'Univerisità di Brema.","Dal 2001, Auffarth è Professore Ordinario di Studi Religiosi con specializzazione in Storia e Teologie del Cristianesimo presso l'Università di Brema.",M,Y,,
"Leach was born in Ballarat, Victoria and educated at Creswick Grammar School (where he was dux), Melbourne Training College (1890) and the University of Melbourne, where he graduated B.Sc. in 1904, M.Sc. in 1906 and in 1912 obtained his doctorate for research in ornithology. <sep> ",Leach was a regular writer and broadcaster on natural history subjects and introduced it into the school curriculum.,M,Leach era un normale scrittore e giornalista riguardo temi di storia naturale e li introdusse nel curriculum scolastico.,Leach era uno scrittore ed emittente regolare su argomenti di storia naturale e lo introdusse nel curriculum scolastico.,M,Y,,
His poems were mentioned in the book Ignorance written by Milan Kundera. <sep> ,"Skácel was the editor of Host do domu, an important literary magazine between 1963 and 1969.",M,"Skácel è stato editore di Host do domu, un'importante rivista letteraria, tra il 1963 e il 1969.","Skácel è stato direttore di Host do domu, importante rivista letteraria tra il 1963 e il 1969.",M,Y,,
"Wark's final full season at Portman Road, 1982–83, had seen him record the highest league goals tally of his career. <sep> ","I was rather taken aback when the doctor entered the Anfield boot room, Wark said.",M,"Fui più sorpreso quando il dottore entrò nello spogliatorio dell'Anfield, disse Wark.","Sono rimasto piuttosto sorpreso quando il dottore è entrato nella stanza degli stivali di Anfield, ha detto Wark.",M,Y,,
"Stoner graduated summa cum laude with an A.B. from Middlebury College in 1977, where he was a student of Murray Dry and Paul Nelson. <sep> ","Before arriving at LSU in 1988, Stoner was an instructor in Politics and Public Policy at Goucher College.",M,"Prima di arrivare alla LSU nel 1988, Stoner fu istruttore di Politica e Politica Pubblica presso il Goucher College.","Prima di arrivare alla LSU nel 1988, Stoner è stato istruttore di politica e politica pubblica al Goucher College.",M,Y,,
"In 2010, he served on a blue ribbon panel assembled by NFL Films for the ten-part documentary series called The Top 100: NFL's Greatest Players. <sep> ","From 1998 to 2007, Lahman was an editor or contributor to more than a dozen sports encyclopedias",M,"Dal 1998 al 2007, Lahman fu redattore o contributore di più di una dozzina di enciclopedie dello sport.","Dal 1998 al 2007, Lahman è stato editore o collaboratore di più di una dozzina di enciclopedie sportive",M,Y,,
After that he presents it to the Board of Directors. <sep> ,"If thesis accepted by the Board, examiner will enter an exam about the thesis.",M,"Se la tesi viene accettata dal consiglio, l'esaminatore comincerà un esame riguardo la tesi.","Se la tesi è accettata dalla Commissione, l'esaminatore inserirà un esame sulla tesi.",M,Y,,
"An explosion aboard Sirago while drydocked at Portsmouth, New Hampshire, on 2 June 1954, killed two men and injured four others. <sep> ","The blast, which occurred during plastic spraying of a main ballast tank, killed two civilian painters and injured a sailor and three other civilian painters.",M,"L'esplosione, avvenuta durante la riverniciatura del serbatoio di zavorra principale, uccise due pittori civili e ferì gravemente un marinaio e altri tre pittori civili.","L'esplosione, avvenuta durante la spruzzatura di plastica di un serbatoio di zavorra principale, ha ucciso due imbianchini civili e ferito un marinaio e altri tre imbianchini civili.",M,Y,,
"This line of chanoyu that his descendants and followers carried on was recognized as the Senke-ryū (千家流, 'school of the house of Sen'). <sep> ","A writer and poet, the tea master referred to the ware and its relationship with the tea ceremony, saying, Though you wipe your hands and brush off the dust and dirt from the vessels, what is the use of all this fuss if the heart is still impure?",M,"Scrittore e poeta, il maestro del tè si riferisce alle porcellane e alla loro relazione con la cerimonia del tè, dicendo: ""Nonostante vi pulite le mani e togliete la polvere e la sporcizia dal recipiente, qual è l'utilità di queste cerimonie se il cuore è ancora impuro?""","Uno scrittore e poeta, il maestro del tè si riferì alla ceramica e al suo rapporto con la cerimonia del tè, dicendo: Anche se ti asciughi le mani e spazzoli via la polvere e lo sporco dai vasi, a che serve tutto questo trambusto se il cuore è ancora impuro?",M,Y,,
"Between the ages of 20 and 25, he sent in a large number of submissions to comics companies, although he ultimately abandoned this approach to breaking into the industry, considering it too much of a lottery. <sep> ","Best known as a writer, Bendis started out as an artist, doing work for local magazines and newspapers, including caricature work.",M,"Più conosciuto come scrittore, Bendis cominciò come artista, lavorando per magazine locali e giornali, inclusi lavori con caricature.","Meglio conosciuto come scrittore, Bendis ha iniziato come artista, lavorando per riviste e giornali locali, incluso il lavoro di caricatura.",M,Y,,
"In Medicine and Surgery he received his doctorate in 1956, where he was also a specialist in speech and sound disorders and ear, nose and throat qualifications. <sep> ",Professor's Honorary Title Sonninen was awarded in 1981.,M,Il professor Sonninen ricevette il suo titolo onorario nel 1981.,Il titolo onorifico del professore Sonninen è stato assegnato nel 1981.,M,Y,,
"Quarles came to Somerset sometime before 1812, for in May 1812, he was one of a commission to supervise the building of a County Clerk's office. <sep> ",Quarles was a lawyer and became a member of the state legislature in 1811 and 1812.,M,Quarles era un avvocato e divenne membro della legislatura statale nel 1811 e 1812.,Quarles era un avvocato e divenne membro della legislatura statale nel 1811 e nel 1812.,M,Y,,
"Around 510 BC, probably seeking new media for his compositions, Euphronios entered the workshop of Euxitheos, a potter who was similarly engaged in experimenting with form and decor in his own work. <sep> ","The stylistic development of Euphronios's work during this period, during which both painter and potter attempted bold and influential experiments, permits a reconstruction of its chronological sequence with some certainty.",M,"Lo sviluppo stilistico dell'opera di Eufronio in questo periodo, durante il quale sia il pittore che il vasaio tentarono esperimenti audaci e influenti, permette di ricostruirne la cronologia con un certo grado di sicurezza.","Lo sviluppo stilistico dell'opera di Eufronio durante questo periodo, durante il quale sia il pittore che il vasaio tentarono esperimenti audaci e influenti, permette di ricostruire con una certa certezza la sua sequenza cronologica.",M,Y,,
