CONTEXT,SENTENCE,GENDER of REFERENT,BENCHMARK TRANSLATION,GOOGLE TRANSLATION,REF2,CORRESPONDENCE,,LINK ORIGINALI
He created the Kantha Bopha Foundation in Zurich in 1992 and became its head. <sep> ,"As both a cellist and a medical doctor, Richner was known by patients, audiences, and donors as Beatocello.",M,"Sia come violoncellista sia come dottore, Richner era conosciuto da pazienti, spettatori e donatori come Beatocello.","Sia come violoncellista che come medico, Richner era conosciuto da pazienti, pubblico e donatori come Beatocello.",M,Y,,
"At the trial, where, among others, members of the Solntsevskaya Bratva were present, he behaved defiantly, standing with his back to the victims' relatives. <sep> ","When the judge announced the verdict, the gangsters shouted at Nagorny: We will bury you alive!",M,"Quando il giudice annunciò il verdetto, i gangster urlarono a Nagorny: ""Ti seppelliremo vivo!""","Quando il giudice ha annunciato il verdetto, i gangster hanno gridato a Nagorny: ti seppelliremo vivo!",M,Y,,
"During the second world war Caulfield's family returned to Bolton in 1945, where his parents were born, to work at the De Havilland factory. <sep> ","Leaving Acton Secondary Modern at the age of 15, Caulfield secured a position as a filing clerk at Crosse & Blackwell and later transferred to the design studio, working on food display and carrying out menial tasks.",M,"Lasciando Acton Secondary Modern a 15 anni, Caulfield si assicurò una posizione come addetto agli archivi presso la Crosse & Blackwell e successivamente fu trasferito nello studio di design, lavorando sull'esposizione del cibo e facendo manzioni da servo.","Lasciando Acton Secondary Modern all'età di 15 anni, Caulfield si è assicurato un posto come archivista presso Crosse & Blackwell e successivamente si è trasferito allo studio di design, lavorando all'esposizione di cibo e svolgendo compiti umili.",M,Y,,
"Shrikanta, Charitrahin, Devdas, Grihadaha, Dena-Paona and Pather Dabi are among his most popular works. <sep> ",Rajshekhar Basu (1880–1960) was the best-known writer of satiric short story in Bengali literature.,M,Rajshekhar Basu (1880–1960) fu il più noto scrittore di racconti brevi satirici della letteratura bengalese.,Rajshekhar Basu (1880-1960) è stato lo scrittore di racconti satirici più noto nella letteratura bengalese.,M,Y,,
"Delecluze, in his Louis David et son temps, has also a brief life of Girodet. <sep> ",The exhibition assembled more than 100 seminal works (about 60 paintings and 40 drawings) that demonstrated the artist's range as a painter as well as a draftsman.,M,"La mostra riuniva oltre 100 opere (circa 60 dipinti e 40 disegni), che riassumevano le abilità dell'artista sia come pittore che come disegnatore.",La mostra ha riunito più di 100 opere fondamentali (circa 60 dipinti e 40 disegni) che hanno dimostrato la gamma dell'artista come pittore e disegnatore.,M,Y,,
"The day after principal photography was completed, Ashby had his editor send what he had cut together so far. <sep> ",The director was shocked at the results and fired the editor.,M,Il direttore fu scioccato dei risultati e licenziò il redattore.,Il regista è rimasto scioccato dai risultati e ha licenziato l'editore.,M,Y,,
Kur received a bachelor's degree from Ithaca College in 1970 and his masters of communications at Columbia University. <sep> ,"Kur's first job in journalism was for the Eastern Educational Network as a researcher, reporter and writer.",M,"Il primo lavoro di Kur nel giornalismo fu ricercatore, reporter e scrittore per Eastern Education Network,","Il primo lavoro di Kur nel giornalismo è stato per l'Eastern Educational Network come ricercatore, giornalista e scrittore.",M,Y,,
"Like Al Bahrani and Nasir, 'Allamah-i Hilli was contemporary with the Mongol upheaval, and played a role similar to that of his teacher. <sep> ",Allamah-i Hilli was a prolific writer whose bibliography comprises about one hundred and twenty titles.,M,Allamah-i Hilli fu uno scrittore prolifico la cui bibliografia comprende circa centoventi titoli.,Allamah-i Hilli è stato uno scrittore prolifico la cui bibliografia comprende circa centoventi titoli.,M,Y,,
"Behan was a self-educated man whose intellect was such that he numbered many respected thinkers among his friends including the likes of Hugh MacDiarmid the Scots poet with whom he lived for three years, Louis MacNeice who became for a time a writing partner – mostly for the BBC overseas program and H. <sep> ","Behan also found time to work in education, having been identified by the Strathclyde Region education dept as the Writer in residence for the Region's secondary schools.",M,"Behan ha anche trovato il tempo di lavorare nell'istruzione, essendo stato identificato dal dipartimento dell'istruzione della regione Strathclyde come l'autore residente per le scuole secondarie della regione.","Behan ha anche trovato il tempo per lavorare nel campo dell'istruzione, essendo stato identificato dal dipartimento dell'istruzione della regione di Strathclyde come scrittore residente per le scuole secondarie della regione.",M,Y,,
"When the producers purchased the rights to his novel, they promised Benchley that he could write the first draft of the screenplay. <sep> ","The intent was to make sure a script could be done despite an impending threat of a Writer's Guild strike, given Benchley was not unionized.",M,"L'intento era di assicurarsi che una sceneggiatura potesse essere portata in scena nonostante l'eventuale minaccia di uno sciopero della Writer's Guild, dato che Benchley non era sindacalizzato.","L'intento era assicurarsi che una sceneggiatura potesse essere realizzata nonostante l'imminente minaccia di uno sciopero della Writer's Guild, dato che Benchley non era sindacalizzata.",F,N,,
"During the next two months he flew six more sorties against targets including Berlin, Hamburg and Karlsruhe, before being posted to No. <sep> ",14 Operational Training Unit as an instructor.,M,14 Unità addestramento operativa come istruttore.,14 Unità di formazione operativa come istruttore.,M,Y,,
"As a sound designer, his credits include the Star Wars and Indiana Jones film series, Invasion of the Body Snatchers (1978), E.T. the Extra-Terrestrial (1982), WALL-E (2008) and Star Trek (2009). <sep> ",Burtt was also the sound editor for WALL-E and performed the vocalizations of the titular character as well as other robots in the film.,M,Burtt è stato anche il sound editor per WALL-E e ha preparato le vocalizzazioni dell'omonimo personaggio e degli altri robot nel film.,Burtt è stato anche il montatore del suono per WALL-E e ha eseguito le vocalizzazioni del personaggio titolare e di altri robot nel film.,M,Y,,
"Born in Enfield, Middlesex, Haining began his career as a reporter in Essex and then moved to London where he worked on a trade magazine before joining the publishing house of New English Library in 1963. <sep> ",Haining achieved the position of Editorial Director before becoming a full-time writer in the early 1970s.,M,Haining riuscì a coprire la posizione di direttore di redazione prima di diventare uno scrittore a tempo pieno all'inizio degli anni 70.,Haining ha raggiunto la posizione di direttore editoriale prima di diventare uno scrittore a tempo pieno all'inizio degli anni '70.,M,Y,,
"In 1828 he was named professor of physiology, pathology and semiotics at the University of Dorpat. <sep> ",Rathke was a professor of zoology and anatomy at Königsberg from 1835 to 1860.,M,Rathke fu un professore di zoologia ed anatomia al Königsberg dal 1835 al 1860.,Rathke fu professore di zoologia e anatomia a Königsberg dal 1835 al 1860.,M,Y,,
A sailor and his girlfriend were walking when four zoot suiters blocked the sidewalk in front of them. <sep> ,"The young zoot-suiter and the sailor stood their ground in silence until finally, the sailor backed away.",M,"Il giovane che indossa zoot suit e il marinaio non indietreggiarono fino a quando, alla fine, il marinaio si tirò indietro.",Il giovane corteggiatore zoot e il marinaio rimasero in silenzio fino a quando il marinaio indietreggiò.,M,Y,,
During his tenure as the head coach of the Michigan Tech Huskies Mancini led the Huskies to three Western Collegiate Hockey Association Final Five appearances. <sep> ,Mancini served as an assistant coach and the director of player personnel for the USA Hockey National Team Development Program from 1997-2000.,M,Mancini ha lavorato come assistente allenatore e direttore del personale dei giocatori per il Programma di Sviluppo del Team Nazionale di Hockey USA dal 1997 al 2000.,Mancini è stato assistente allenatore e direttore del personale dei giocatori per il programma di sviluppo della squadra nazionale di hockey USA dal 1997 al 2000.,M,Y,,
In 1984 he was habilitated and in 1985 received a professorship for musicology at the Johannes Gutenberg University Mainz. <sep> ,Ruf is editor and co-publisher of numerous publications.,M,Ruf è redattore e co-editore di numerose pubblicazioni.,Ruf è editore e coeditore di numerose pubblicazioni.,M,Y,,
She attended North Ealing Primary School and Ealing County Grammar School for Girls. <sep> ,"While attending the Guildhall School, Blackman worked as a clerical assistant for the Home Office.",F,"Mentre frequentava la Guildhall School, Blackman lavorò come impiegata al Ministero degli Interni.","Mentre frequentava la Guildhall School, Blackman ha lavorato come assistente impiegato per il Ministero degli Interni.",M,N,,
"Accordingly, the Gardners received her at an appropriate age for research into language development. <sep> ",There was always a researcher or assistant in attendance during Washoe's waking hours.,F,Washoe era affiancata tutto il giorno da un ricercatore o un assistente.,C'era sempre un ricercatore o un assistente presente durante le ore di veglia di Washoe.,N/D,A,,
Her job on the Showtime series was her first on a show written for cable <sep> ,Rosenberg initially worked as a consulting producer and writer on the first season.,F,"Nel corso della prima stagione, Rosenberg lavorò inizialmente come consulente di produzione e sceneggiatrice.",Rosenberg inizialmente ha lavorato come consulente produttore e sceneggiatore nella prima stagione.,M,N,,
"McCaskill started with a large financial disadvantage, but she was also an experienced candidate with high name recognition. <sep> ",McCaskill had run two successful campaigns for state auditor.,F,McCaskill aveva partecipato con successo a due campagne per diventare revisora dei conti.,McCaskill aveva condotto due campagne di successo per revisore dei conti.,M,N,,
She was ordained priest in 2010 in the Diocese of Karlstad by Bishop Esbjörn Hagberg. <sep>,Johannesson was accepted as an associate professor of religious philosophy at Uppsala University in 2015.,F,"Nel 2015, Johannesson è stata accettata come professoressa associata di filosofia della religione all'Università di Uppsala.",Johannesson è stato accettato come professore associato di filosofia religiosa presso l'Università di Uppsala nel 2015.,M,N,,
"Currently dean at the Beaconhouse National University's school of visual arts, she is known to promote a unique intellectual perspective among students, teaching them to appreciate nature, cultural traditions and sacredness of the crafts. <sep> ",Hashmi was also professor and the head of the National College of Arts.,F,Hashmi è stata anche docente e direttrice del National College of Arts.,Hashmi era anche professore e capo del National College of Arts.,M,N,,
"The high percentage of women working part-time has been explained by social norms and the historical context of the country, where women were among the last in Europe to enter the workforce, and when they did, most of them did so on a part-time basis; according to The Economist, fewer Dutch men had to fight in the World Wars of the 20th century, and so Dutch women did not experience working for pay at rates women in other countries did. <sep> ",Research in 2016 led by professor Stijn Baert (Ghent University) debunked the idea that part-time work by students is an asset for their CV in respect of later employment chances.,F,"Una ricerca condotta nel 2016 dal professor Stijn Baert (Università di Gand) confutò l'idea secondo cui il lavoro part-time svolto da studentesse rendesse più appetibile il loro curriculum, aumentandone il potenziale occupazionale.",Una ricerca del 2016 condotta dal professor Stijn Baert (Università di Ghent) ha smentito l'idea che il lavoro part-time da parte degli studenti sia una risorsa per il loro CV rispetto alle successive possibilità di impiego.,M,N,,
"Subsequently, she trained in London as a psychiatric nurse, becoming a Registered Nurse (RN) and a Psychiatric Nurse (PN) before returning to Canada. <sep> ","Bridgman went on to earn the Director of Nursing designation from the University of Saskatchewan, rising to become a nurse administrator.",F,"Bridgman fu poi abilitata alle funzioni direttive dell'assistenza infermieristica dall'Università del Saskatchewan, diventando quindi coordinatrice infermieristica.","Bridgman ha continuato a guadagnare la designazione di Direttore infermieristico presso l'Università del Saskatchewan, diventando un amministratore infermiere.",M,N,,
"She became an invalid in her later years, and died on 28 May 1901. <sep> ",Westcott was not a narrow specialist.,F,Westcott non era strettamente una specialista.,Westcott non era uno specialista ristretto.,M,N,,
"On November 7, 2008, judge Szczepańska upheld the city staff decision, and charged the women with indecent exposure, explaining that their personal freedoms cannot encroach on the freedoms of families with children who frequent the same recreation spot. <sep> ","Although topless sunbathing is not prohibited in Poland, the judge sentenced them to pay a fine of 230 zloty (150 zloty by different source, or €40, $55) for breaking the rules of conduct.",F,"Sebbene prendere il sole in topless non sia vietato in Polonia, il giudice le ha condannate a pagare una multa di 230 złoty (150 secondo un'altra fonte, che corrispondono a 40 euro o 55 dollari) per aver violato il codice di condotta.","Sebbene prendere il sole in topless non sia proibito in Polonia, il giudice le ha condannate a pagare una multa di 230 zloty (150 zloty secondo fonti diverse, o 40 euro, 55 dollari) per aver violato le regole di condotta.",F,Y,,
Her winning the largest number of medals at the Turin Olympics caused IOC president Jacques Rogge to call her the woman of the games. <sep> ,"The following day, February 27, Klassen signed the most lucrative endorsement deal ever for a Canadian amateur athlete, with Manitoba Telecom Services (MTS), estimated at about $1 million.",F,"Il giorno seguente, il 27 febbraio, Klassen firmò con la Manitoba Telecom Services (MTS) il contratto più redditizio di sempre per un'atleta amatoriale canadese, il cui valore ammontava a circa un milione di dollari.","Il giorno successivo, il 27 febbraio, Klassen ha firmato l'accordo di sponsorizzazione più redditizio di sempre per un atleta dilettante canadese, con Manitoba Telecom Services (MTS), stimato in circa $ 1 milione.",M,N,,
"The impression given to the audience was that, because of the restraints and limited room in the box, the assistant's waist must have been in the path of the saw and she would surely have been cut through. <sep> ","Finally the box was opened and the assistant, still with ropes attached, was revealed as unharmed.",F,"Alla fine la scatola viene aperta e l'assistente, ancora legata con le corde, viene mostrata illesa.","Finalmente la scatola è stata aperta e l'assistente, ancora con le corde attaccate, è risultato illeso.",M,N,,
"Kulkarni was born in Bijapur, Karnataka and her parents moved to Australia in 1961 when she was three years old. <sep> ",Kulkarni worked as a doctor specialising in accident and emergency medicine before becoming a psychiatrist.,F,"Kulkarni ha lavorato come medico, specializzandosi in medicina d'emergenza-urgenza, prima di diventare una psichiatra.",Kulkarni ha lavorato come medico specializzato in medicina degli incidenti e d'urgenza prima di diventare psichiatra.,N/D,A,,
"In her fictionalized account of Murasaki's life, The Tale of Murasaki: A Novel, Liza Dalby has Murasaki involved in a romance during her travels with her father to Echizen Province. <sep> ",McCullough writes that Murasaki is both the quintessential representative of a unique society and a writer who speaks to universal human concerns with a timeless voice.,F,McCullough scrive che Murasaki è al contempo la massima esponente di una società unica e una scrittrice che parla di questioni umane universali con una voce senza tempo.,McCullough scrive che Murasaki è sia il rappresentante per eccellenza di una società unica sia uno scrittore che parla alle preoccupazioni umane universali con una voce senza tempo.,M,N,,
"In 2009, student Robin Yerkes secured Roanoke's fourth national championship when she won an individual championship in the Division III women's 400m track and field event. <sep> ","Yerkes is the most decorated athlete ever to graduate from Roanoke, earning 12 All-American honors in multiple events.",F,"Yerkes è l'atleta più decorata di sempre nella storia del Roanoke College, avendo vinto 12 titoli All-American in diverse gare.","Yerkes è l'atleta più decorato che si sia mai diplomato a Roanoke, guadagnando 12 onorificenze All-American in più eventi.",M,N,,
"Didrikson's first job after high school was as a secretary for the Employers' Casualty Insurance Company of Dallas, though she was employed only in order to play basketball as an amateur on the company's industrial team, the Golden Cyclones. <sep> ","Despite leading the team to an AAU Basketball Championship in 1931, Didrikson had first achieved wider attention as a track and field athlete.",F,"Pur avendo portato la squadra a vincere il campionato di basket AAU nel 1931, Didrikson era già famosa come esponente dell'atletica leggera.","Nonostante avesse guidato la squadra a un campionato di basket AAU nel 1931, Didrikson aveva ottenuto per la prima volta un'attenzione più ampia come atleta di atletica leggera.",N/D,A,,
"She studied Architecture at University College Dublin, where she shared a drawing desk with Ruairi Quinn. <sep> ",McManus is an accomplished writer.,F,McManus è una scrittrice affermata.,McManus è uno scrittore affermato.,M,N,,
"The name, she later explained in an interview, referred to a woman who is industrious and helps her community... women are called ' obaa sima ' when they have made it through their own efforts – it is the embodiment of the traditional woman. <sep> ","Abbam was owner, editor and principal contributor to the magazine.",F,"Abbam era proprietaria e curatrice della rivista, per la quale scriveva la maggior parte dei contributi.","Abbam era proprietario, editore e principale collaboratore della rivista.",M,N,,
"Weizmann replied half a year later, supporting her desire to receive a post of pathologist but explaining administrative structures first needed to be established. <sep> ",Finally matters were sorted out and Getzowa was engaged as a pathological specialist.,F,"Alla fine, la questione è stata risolta e Getzowa è stata assunta come specialista in patologia.",Alla fine le cose furono risolte e Getzowa fu assunto come specialista patologico.,M,N,,
Lithiby continued with the work and in due course donated twenty watercolours to the Imperial War Museum which form a rare artistic record of the work of women in military service at the time. <sep> ,"From 1920 to 1939, Lithiby worked as a figure and landscape painter and muralist.",F,"Dal 1920 al 1939, Lithiby ha lavorato come pittrice di figure, paesaggi e murali.","Dal 1920 al 1939, Lithiby ha lavorato come pittore di figure e paesaggi e muralista.",M,N,,
She serves as an advisor to the Calgary Centre for Global Community and on the board of David Korten's People-Centered Development Forum. <sep> ,Lappé is a Contributing Editor to YES!,F,Lappé è una dei redattori di YES!,Lappé è un redattore collaboratore di YES!,M,N,,
"Mudge missed much of the 2005 season, first recuperating from an operation to rehabilitate a damaged knee which left her on crutches, and then succumbing to a bout of plantar fasciitis between May and July. <sep> ","I was running on the bare bone of my femur, so the surgeon drilled a lot of holes, which stimulates scar tissue, and eventually, I could run again.",F,"Praticamente non c'era più niente tra il femore e il ginocchio, così il chirurgo ha praticato diversi fori per stimolare la formazione di tessuto cicatriziale, e alla fine sono tornata a correre.","Stavo correndo sull'osso nudo del mio femore, quindi il chirurgo ha praticato molti fori, che stimolano il tessuto cicatriziale, e alla fine ho potuto correre di nuovo.",N/D,A,,
"The poet Phillis Wheatley (c.1753–84) published her book Poems on Various Subjects, Religious and Moral in 1773, three years before American independence. <sep> ","Wheatley was not only the first African American to publish a book, but the first to achieve an international reputation as a writer.",F,"Wheatley non è stata solo la prima afroamericana a pubblicare un libro, ma anche la prima a ottenere fama internazionale come scrittrice.","Wheatley non fu solo il primo afroamericano a pubblicare un libro, ma il primo a raggiungere una reputazione internazionale come scrittore.",M,N,,
"From 1959 to 1960, she directed a survey of the Cataloging-in-Source experiment conducted by the Library of Congress; though her 1960 report was pessimistic about the possibility of a national project which would provide cataloging within published books, it was the prelude to the successful 1971 introduction of the Cataloging in Publication program. <sep> ",Piercy served as the editor of the Journal of Cataloging and Classification from 1950 to 1956.,F,"Dal 1950 al 1956, Piercy è stata editrice per il Journal of Cataloging and Classification.",Piercy è stato redattore del Journal of Cataloging and Classification dal 1950 al 1956.,M,N,,
She called the company Silver Lining. <sep> ,Lunde started working as an aerospace technologist for the FAA in 2003 as a Training Specialist.,F,"Lunde iniziò a lavorare come ingegnera aerospaziale per la FAA nel 2003, in qualità di apprendista specialista.",Lunde ha iniziato a lavorare come tecnologo aerospaziale per la FAA nel 2003 come specialista della formazione.,M,N,,
Her PhD thesis was entitled Fluctuations in systems far from equilibrium. <sep> ,Marchetti was an assistant professor at Syracuse University from 1987 to 1997.,F,Marchetti è stata assistente universitaria presso l'Università di Syracuse dal 1987 al 1997.,Marchetti è stato assistant professor alla Syracuse University dal 1987 al 1997.,M,N,,
"She finished third and fifth, respectively. <sep> ","The team needed vault specialists, and Vise was a bar and beam specialist.",F,"La squadra aveva bisogno di una specialista di volteggio, e Vise era specializzata in parallele e trave.",Il team aveva bisogno di specialisti del caveau e Vise era uno specialista di barre e travi.,M,N,,
"Stephanie realizes that Abruzzi is conducting psychological warfare against her, believing that she knows where Evelyn is. <sep> ","Abruzzi, besides being a wargamer, is an avid collector of military memorabilia, and believes the medal is a lucky talisman.",F,"Oltre a essere una wargamer, Abruzzi è un'avida collezionista di cimeli militari, e crede che quella medaglia sia un portafortuna.","Abruzzi, oltre ad essere un wargamer, è un appassionato collezionista di cimeli militari, e crede che la medaglia sia un talismano portafortuna.",M,N,,
She then moved on to Simon Fraser University where she graduated with her doctorate in educational psychology and the Dean's Medal for a 4.33 cumulative grade point average. <sep> ,"While a doctoral student, Muis served on the Provincial Degree Program Review Committee and served as a research assistant.",F,"Durante il periodo come dottoranda, Muis lavorò per il Provincial Degree Program Review Committee e come assistente di ricerca.","Mentre era uno studente di dottorato, Muis ha fatto parte del comitato provinciale di revisione del programma di laurea ed è stato assistente di ricerca.",M,N,,
"In May 2018, she started a nonprofit Nap4Lyme, to raise awareness and money for the Disease. <sep> ","McGee was the co-founder and editor of a health education site FYILiving.com, which was acquired by Action Factory.",F,"McGee era la co-fondatrice e redattrice del sito di educazione alla salute FYILiving.com, acquistato poi da Action Factory.","McGee è stato il co-fondatore ed editore di un sito di educazione sanitaria FYILiving.com, che è stato acquisito da Action Factory.",M,N,,
"Serrano has won her last two world title defenses, both decisions, one in ten rounds in Las Vegas and another one, a six-round win in Phoenix. <sep> ",Serrano is also a lawyer.,F,Serrano è anche un'avvocata.,Serrano è anche un avvocato.,M,N,,
"She completed another postdoctoral fellowship at the University of Zurich, where she worked with Volker Henn and Bernhard Hess. <sep> ",Angelaki was made an Assistant Professor at the University of Mississippi in 1993.,F,"Nel 1993, Angelaki fu nominata assistente presso l'Università del Mississippi.",Angelaki è stata nominata Assistant Professor presso l'Università del Mississippi nel 1993.,F,Y,,
