CONTEXT,SENTENCE,GENDER of REFERENT,BENCHMARK TRANSLATION,GOOGLE TRANSLATION,REF2,CORRESPONDENCE,,LINK ORIGINALI
"While Dhumavati is generally associated with only inauspicious qualities, her thousand-name hymn relates her positive aspects as well as her negative ones. <sep> ","Dhumavati is described as a great teacher, one who reveals ultimate knowledge of the universe, which is beyond the illusory divisions, like auspicious and inauspicious.",F,"Dhumavati viene descritta come una grande insegnante, in grado di rivelare le più alte conoscenze sull'universo, che trascende qualsiasi dicotomia illusoria, come ad esempio quella tra buoni e cattivi auspici.","Dhumavati è descritto come un grande maestro, uno che rivela la conoscenza ultima dell'universo, che è al di là delle divisioni illusorie, come di buon auspicio e infausto.",M,N,,
"In October 2005, Wightman was indicted in Boston, Massachusetts for practicing psychology without a license, filing false health care claims, and engaging in insurance fraud after local FOX affiliate WFXT did an undercover investigation into her therapy practice. <sep> ","Under unusual provisions of Massachusetts law, Wightman had been allowed to practice as a psychotherapist, not as a psychologist.",F,"In base ad alcune insolite disposizioni della Legge del Massachusetts, Wightman può esercitare come psicoterapeuta anziché come psicologa.","In base a disposizioni insolite della legge del Massachusetts, Wightman era stato autorizzato a esercitare come psicoterapeuta, non come psicologo.",M,N,,
"In 2013, Miranda Lambert tied McEntire to win Female Vocalist four years in a row and in 2016 Carrie Underwood joined this elite club by winning her fourth Female Vocalist award. <sep> ","McEntire is also a rare musical artist to achieve solo number-ones across four decades (1980s, 1990s, 2000s, 2010s).",F,"McEntire è anche una delle poche musiciste a ottenere questo risultato in quattro decenni diversi ('80, '90, '00 e '10).","McEntire è anche un raro artista musicale ad aver raggiunto il numero uno da solista in quattro decenni (anni '80, '90, 2000, 2010).",M,N,,
"In Taxation and Innovation in the 20th Century she analyzes the impacts of individual and corporate income taxes on individual inventors, firms that do R&D, and on innovation at the state level in the U.S. throughout the 20th century. <sep> ",Stantcheva has made numerous appearances in the media both as an author and a speaker.,F,Stantcheva ha fatto diverse apparizioni mediatiche sia come autrice che come oratrice.,Stantcheva ha fatto numerose apparizioni sui media sia come autrice che come relatrice.,F,Y,,
"In 2020, she announced the establishment of a publishing company, Bumblehill Press. <sep> ","As an artist, Windling specializes in work inspired by myth, folklore, and fairy tales.",F,"Come artista, Windling è specializzata in lavori che traggono ispirazione da miti, folklore e fiabe.","Come artista, Windling è specializzato in lavori ispirati al mito, al folklore e alle fiabe.",M,N,,
"With the packed house at The Week Rio, and an audience of about three thousand people, Gil celebrated the anniversary of her show and pre-release of his DVD/Blu-ray which hits stores in August: It's eight-year career and three of them working on this show. <sep> ",Today I am an artist mature and aware enough of my segment.,F,Oggi sono un'artista matura e consapevole del mio segmento.,Oggi sono un artista abbastanza maturo e consapevole del mio segmento.,M,N,,
"Soon after she helped form Amici Forever with which she released two successful albums, The Opera Band (2004) and Defined (2005). <sep> ",Maswanganyi is also active as a solo artist on both the concert and opera stages.,F,"Inoltre, Maswanganyi è attiva come solista e si esibisce in concerti e opere liriche.",Maswanganyi è anche attivo come artista solista sia sul palco dei concerti che su quello dell'opera.,M,N,,
"As her interest in entertainment developed, Angela and her sister would often put on shows, reading poems or performing popular music for their family. <sep> ","At Boca Ciega High School, Bassett was a cheerleader and a member of the Upward Bound college prep program, the debate team, student government, drama club and choir.",F,"Alla Boca Ciega High School, Bassett fece la cheerleader e fu membro del programma di orientamento al college Upward Bound, dei club di oratoria e teatro, del governo studentesco e del coro.","Alla Boca Ciega High School, Bassett era una cheerleader e un membro del programma di preparazione al college Upward Bound, della squadra di dibattito, del governo studentesco, del club teatrale e del coro.",F,Y,,
She continued co-editing the journal until February 1927. <sep> ,Gollock was also Secretary of the Board of Study for the Preparation of Missionaries.,F,Gollock fu anche Segretaria del Board of Study for the Preparation of Missionaries.,Gollock fu anche Segretario del Consiglio di Studio per la Preparazione dei Missionari.,M,N,,
"She then enrolled at St Mary's University College, a third-level college for women established by the Dominicans in 1893, to study modern languages (in her case, French and German). <sep> ",This led to a career as a teacher in Eccles Street and an examiner in the Intermediate Certificate examination.,F,Ciò la portò a diventare insegnante a Eccles Street ed esaminatrice nell'ambito dell'Intermediate Certificate.,Ciò ha portato a una carriera come insegnante in Eccles Street e come esaminatore nell'esame del certificato intermedio.,M,N,,
"In commission schools female dancers have the choice to wear either a wig or curl their hair, but usually in championship levels, girls choose to wear a wig, as wigs are more convenient and popular. <sep> ",Dancers get synthetic ringlet wigs that match their hair color or go with an extremely different shade (a blonde dancer wearing a black wig or vice versa).,F,"Le ballerine indossano parrucche ricce sintetiche dello stesso colore dei loro capelli o di un colore completamente diverso (per esempio, una ballerina bionda con i capelli neri o viceversa).",I ballerini ottengono parrucche sintetiche a ricciolo che si abbinano al colore dei loro capelli o vanno con una tonalità estremamente diversa (una ballerina bionda indossa una parrucca nera o viceversa).,M,N,,
"Growing up with a carefree nature, she was an introvert and was the kind of girl who loved reading, writing and drawing. <sep> ","Aw wanted to be a dancer, an artist or a child psychologist.",F,"Aw voleva diventare una ballerina, un'artista o una psicologa infantile.","Aw voleva essere un ballerino, un artista o uno psicologo infantile.",M,N,,
"After scouring the plates in the scullery, she would leave them on racks to dry. <sep> ","The duties of the scullery-maid are to assist the cook; to keep the scullery clean, and all the metallic as well as earthenware kitchen utensils.",F,"Tra le mansioni di una sguattera ci sono: assistere il cuoco, tenere pulito il retrocucina e tutti gli utensili, sia quelli metallici che quelli di coccio.",I doveri della sguattera sono di assistere il cuoco; per tenere pulito il retrocucina e tutti gli utensili da cucina metallici e di terracotta.,F,Y,,
"One of those was Geertruida (Truus) Meuleman, who lived on the same street as Peaux and was the daughter of the rector of the local gymnasium. <sep> ","Meuleman was educated to be a teacher, and the two shared a love for Scandinavian literature and landscape.",F,"Meuleman studiò per diventare insegnante, e le due condivisero una passione per la letteratura e i paesaggi scandinavi.",Meuleman è stato educato per diventare un insegnante e i due condividevano l'amore per la letteratura e il paesaggio scandinavi.,M,N,,
"On July 18, 2010, the Long Island International Film Expo honored the actress with its Long Island Creative Achievement Award. <sep> ","The next year, Moriarty appeared as a nurse in the film 1320.",F,"L'anno successivo, Moriarty è apparsa nel film 1320 nei panni di un'infermiera.","L'anno successivo, Moriarty è apparsa come infermiera nel film 1320.",F,Y,,
"Unlike the heroine of the novel, she did not survive, but is commemorated in the church. <sep> ","According to the preface, the work is a romance and not a historical novel, because the author neither dares, nor desires, to claim for it the dignity or cumber it with the difficulty of an historical novel.",F,"Stando alla prefazione si tratta di un romanzo rosa e non storico, perché l'autrice non vuole né osa accostare la sua opera alla dignità e alla complessità di un romanzo storico.","Secondo la prefazione, l'opera è un romanzo d'amore e non un romanzo storico, perché l'autore non osa, né desidera, rivendicare per essa la dignità o appesantirla con la difficoltà di un romanzo storico.",M,N,,
"In front of the bust is a figure of a seated female school teacher holding the hand of a young, female student. <sep> ",The scene represents the close relationship between teacher and student that Zahle endorsed.,F,La scena rappresenta lo stretto rapporto tra insegnante e studentessa promosso da Zahle.,La scena rappresenta lo stretto rapporto tra insegnante e studente che Zahle ha approvato.,M,N,,
The successful publication of the short story also won her acclaim in the literary circles of her time. <sep> ,"They were impressed with the author's goal, which was to dig into the commonplace, this vulgar American life, and see what is in it.",F,"Rimasero colpiti dallo scopo che si era prefissata l'autrice, ossia di scavare nella sfera dell'ordinario, della vita popolare americana, e vedere cosa ci fosse.","Sono rimasti colpiti dall'obiettivo dell'autore, che era quello di scavare nel luogo comune, questa volgare vita americana, e vedere cosa c'è dentro.",M,N,,
The book includes anecdotes about and illustrations of many of her extended family (see Darwin–Wedgwood family). <sep> ,The book is illustrated throughout with wood engravings by the author.,F,Il libro contiene diverse illustrazioni realizzate dall'autrice sotto forma di xilografie.,Il libro è interamente illustrato con incisioni su legno dell'autore.,M,N,,
"In 2008, she translated Junot Diaz's Pulitzer Prize-winning novel, The Brief and Wondrous Life of Oscar Wao, into Spanish. <sep>","The Dominican-American author's novel addresses many themes, including young adult sexuality and national identity, also present in Obejas' work.",F,"Il romanzo della scrittrice dominicana-americana affronta vari temi, tra cui la sessualità giovanile e l'identità nazionale, presenti anche nei lavori di Obejas.","Il romanzo dell'autore dominicano-americano affronta molti temi, tra cui la sessualità dei giovani adulti e l'identità nazionale, presenti anche nell'opera di Obejas.",M,N,,
He is close friends with Harley's father.[vol. 49:extra] His Japanese voice actor is Masato Sako and Shinji Ogawa while his English voice actor is Doug Burks. <sep> ,"Otaki is the head inspector of the Osaka district, and good friends with Heizo Hattori and Ginshiro Toyama.",M,Otaki è ispettore capo del distretto di Osaka e grande amico di Heizo Hattori e Ginshiro Toyama.,Otaki è l'ispettore capo del distretto di Osaka e buon amico di Heizo Hattori e Ginshiro Toyama.,M,Y,,
"Alongside his communications management roles he specialised in crisis management and counterterrorist issues, and his final posting was to create and lead Britain's civil crisis management unit and the government's communication specialists. <sep> ","After working as a trade and local news journalist, Granatt joined the civil service in 1979 as an information officer.",M,"Dopo aver lavorato come giornalista di settore e di notizie locali, Granatt si unì al servizio civile nel 1979 come ufficiale informativo.","Dopo aver lavorato come giornalista specializzato e di cronaca locale, Granatt è entrato a far parte del servizio civile nel 1979 come addetto all'informazione.",M,Y,,
He is the co-founder and CEO of Vivaldi Technologies. <sep> ,Tetzchner is also a co-founder and the former CEO of Opera Software.,M,Tetzchner è anche co-fondatore ed ex amministratore delegato di Opera Software.,Tetzchner è anche co-fondatore ed ex CEO di Opera Software.,M,Y,,
"Kotzen would later be expelled from the band following the world tour, after it was discovered that he had been romantically involved with the fiancee of drummer Rikki Rockett. <sep> ",Kotzen would later claim that being in Poison helped me forget I was a musician while Rockett would lament the loss of the band's original attitude,M,Kotzen avrebbe successivamente affermato che essere a Poison l'avrebbe aiutato a dimenticare che fosse un musicista mentre Rockett si sarebbe lamentato della perdita dell'originale attitudine della band.,Kotzen in seguito avrebbe affermato che essere nei Poison mi ha aiutato a dimenticare di essere un musicista mentre Rockett si sarebbe lamentato della perdita dell'atteggiamento originale della band,M,Y,,
"Ten years later, he was to have been included in one of the spy exchanges at Berlin's Glienicke Bridge but chose to remain in Poland and spent the rest of his life as a painter and faith healer in Warsaw, where he died. <sep> ",Pawlowski was born in Warsaw in a family of a car mechanic and studied law at university there.,M,"Pawlowski nacque a Varsavia, figlio di un meccanico, e studiò legge nella stessa città.",Pawlowski è nato a Varsavia in una famiglia di un meccanico di automobili e lì ha studiato legge all'università.,M,Y,,
"In addition to his substantial contributions to web standards, Pemberton was also one of the developers of the ABC programming language and of the Views System, an open-architecture user interface system and application environment. <sep> ",Pemberton was editor-in-chief of SIGCHI Bulletin from 1993 to 1999 and of ACM Interactions from 1998 to 2004.,M,Pemberton è stato caporedattore del SIGCHI Bulletin dal 1993 al 1999 e di ACM Interactions dal 1998 al 2004.,Pemberton è stato redattore capo di SIGCHI Bulletin dal 1993 al 1999 e di ACM Interactions dal 1998 al 2004.,M,Y,,
"In 1865, after 15 years of service as an officer, Luitenant Tan Tjoen Tiat was raised to the rank his father-in-law had held, that of Kapitein. <sep> ","This mayoral elevation went against existing tradition, which favoured the longest-serving Kapiteins from long-established officer families, and thus showed the confidence in which the colonial government held the new Majoor.",M,"Questa promozione andava contro la tradizione, che favoriva i Kapiteins di lungo servizio rispetto alle famiglie degli ufficiali di lungo corso, mostrando dunque il grado di fiducia che il governo coloniale riponeva nel nuovo Majoor.","Questa elevazione a sindaco andava contro la tradizione esistente, che favoriva i Kapitein più longevi provenienti da famiglie di ufficiali di lunga data, e mostrava quindi la fiducia in cui il governo coloniale nutriva il nuovo maggiore.",M,Y,,
"When Bjerknes' grant ended, he was hired by Otto Pettersson as his main assistant at the Swedish Hydrographic and Biological Commission. <sep> ",Pettersson is the chief scientist of the Commission's research vessel fleet.,M,Pettersson è il direttore scientifico della flotta di ricerca della Commissione.,Pettersson è il capo scienziato della flotta di navi da ricerca della Commissione.,M,Y,,
"While still a student in the sixth year of composition, Vicente Emilio Sojo commissioned an orchestral suite from him. <sep> ",It was with this composition that Estévez premiered as conductor in the same year.,M,Fu con questa composizione che Estévez fece il suo debutto come direttore nello stesso anno.,Fu con questa composizione che Estévez debuttò come direttore nello stesso anno.,M,Y,,
It's like he's had it – it ain't no fun no more. <sep> ,"The curse part of it is the business you have to deal with, and then the blessing part is you get to be a musician and have fun…",M,"La sua parte maledetta è il business con il quale devi interfacciarti, e invece la parte buona è che puoi essere un musicista e divertirti...","La parte maledetta è l'affare che devi affrontare, e poi la parte benedetta è che diventi un musicista e ti diverti...",M,Y,,
He also served in that chamber's party leadership as the Senate Democratic Caucus Secretary from 2005 to 2010. <sep> ,Albertson is a singer-songwriter and musician that has toured in 26 countries.,M,Albertson è un cantante cantautore e strumentista che ha fatto tour in 26 paesi.,Albertson è un cantautore e musicista che è stato in tournée in 26 paesi.,M,Y,,
"The Hasidim then asked the Rebbe's daughter Malka and her husband, Rabbi Dr. Menachem Mendel Brayer, a teacher at Yeshiva University, to offer one of their two young sons to be groomed for the position. <sep> ","The elder, Yigal, an aerospace engineer, was suggested and then rejected.",M,"Il più grande, Yigal, ingegnere aerospaziale, fu proposto e poi rifiutato.","L'anziano, Yigal, un ingegnere aerospaziale, è stato suggerito e poi rifiutato.",M,Y,,
"He rather sharply and emotionally criticized his predecessors and opponents, but he treated students warmly, seeing them as like-minded people, communicated informally, took them to exhibitions, to the cinema, to cafes. <sep> ","A successful career was overshadowed by the fact that Zinoviev was in fact restricted to leave, although the scientist was repeatedly invited to foreign events.",M,"Una carriera di successo fu oscurata dal fatto che Zinoviev era di fatto impossibilitato ad andarsene, nonostante lo scienziato fosse ripetutamente invitato a convegni esteri.","Una carriera di successo è stata offuscata dal fatto che Zinoviev era in realtà costretto ad andarsene, sebbene lo scienziato fosse ripetutamente invitato a eventi stranieri.",M,Y,,
He lived for about 10 years in the South of France where he built yachts. <sep> ,"Huggett was reported to have been an intelligence officer, who from 1989 ran a school for children in Hampshire.",M,"Hugget è stato un ufficiale dell'intelligence, che dal 1989 ha gestito una scuola per bambini nell'Hampshire.","Si dice che Huggett fosse un ufficiale dell'intelligence, che dal 1989 gestiva una scuola per bambini nell'Hampshire.",M,Y,,
His gallantry had enabled his comrades to overcome twice their own number of the enemy. <sep> ,Donnini at 19 was the youngest soldier in the Second World War to be awarded the VC.,M,Donnini a 19 anni fu il più giovane soldato nella seconda guerra mondiale ad essere premiato con il VC.,Donnini a 19 anni è stato il più giovane soldato della seconda guerra mondiale ad essere insignito del VC.,M,Y,,
"The officer was never identified, although Boswell gave a description of him at the time. <sep> ","One SCS officer was convicted in 1983 of beating up suspects on the evidence of a police cadet, who was subsequently ostracised and resigned.",M,"Un agente della SCS venne accusato nel 1983 di aver picchiato dei sospettati su segnalazione di un cadetto della polizia, il quale fu poi ostracizzato e costretto a rassegnare le dimissioni.","Un agente dell'SCS è stato condannato nel 1983 per aver picchiato sospetti sulla base delle prove di un cadetto della polizia, che è stato successivamente ostracizzato e si è dimesso.",M,Y,,
"Faced with a wave of sell orders and needing to raise money for redemptions, the manager of an open-ended fund may be forced to sell stocks he would rather keep, and keep stocks he would rather sell, because of liquidity concerns (selling too much of any one stock causes the price to drop disproportionately). <sep> ","But an investor pulling out of a closed-end fund must sell it on the market to another buyer, so the manager need not sell any of the underlying stock.",M,"Ma un investitore che si ritira da un fondo chiuso deve vendere sul mercato ad un altro compratore, così il manager non deve avere la necessità di vendere nessuna delle azioni.","Ma un investitore che si ritira da un fondo chiuso deve venderlo sul mercato a un altro acquirente, quindi il gestore non ha bisogno di vendere nessuna delle azioni sottostanti.",M,Y,,
"Part of his recording of The Rite of Spring, augmented by a rehearsal recording unobtainable elsewhere, was used by Decca on the company's 1957 stereo demonstration LP, A Journey into Stereo Sound. <sep> ",The conductor's clear and methodical counting of beats is a distinct feature of this rehearsal sequence.,M,Il conteggio chiaro e metodico delle battute da parte del direttore d'orchestra è uno dei tratti distintivi di questa sequenza delle prove.,Il conteggio chiaro e metodico delle battute del direttore è una caratteristica distintiva di questa sequenza di prove.,M,Y,,
He also contributed to the Royal Society and the International Union for Co-operation in Solar Research. <sep> ,This was an important appointment for such a junior scientist.,M,Si trattava di una nomina importantissima per uno scienziato così giovane.,Questo è stato un appuntamento importante per uno scienziato così giovane.,M,Y,,
"Grote went on to accept a faculty position as an associate professor of chemistry at his alma mater in 1931, and eventually moved on to professor of chemistry in 1941. <sep> ","From 1941 to 1972 Grote also served as scientific advisor for the Chattanooga Medicine Company, later to be called Chattem Co.",M,"Dal 1941 al 1972 Grote ha lavorato come consulente scientifico per la Chattanooga Medicine Company, in seguito chiamata Chattem Co.","Dal 1941 al 1972 Grote servì anche come consulente scientifico per la Chattanooga Medicine Company, in seguito chiamata Chattem Co.",N/D,A,,
"It was thought that he was used to driving without a speedometer and so had misjudged his speed on the approach to Lincoln, entering a 15 mph curve at around 55 mph. <sep> ","The driver had also evidently been inattentive because the home signal near the curve was not cleared until the train was almost at it, yet it passed the signal at around 60 mph.",M,"Era evidente che anche il macchinista fosse stato disattento, perché il segnale di avanzamento nei pressi della curva non aveva concesso il via se non quando il treno era a pochi metri da esso, eppure il convoglio stava viaggiando a circa 60 miglia orarie in quel punto.","Evidentemente l'autista era stato anche distratto perché il segnale di casa vicino alla curva non era stato cancellato fino a quando il treno non era quasi arrivato, eppure ha superato il segnale a circa 60 mph.",M,Y,,
"To apease him, Asquith invited Isaacs to join the Cabinet; he was the first attorney general to sit in the Cabinet. <sep> ","As law officer, Isaacs handled many high-profile cases.",M,"In quanto funzionario della legge, Isaacs ha trattato molti casi di alto profilo.","In qualità di agente legale, Isaacs ha gestito molti casi di alto profilo.",N/D,A,,
The driver saw Duggan move onto the road in front of him. <sep> ,"The car swerved from the inside lane to the outside, but the driver said Duggan leapt in front of the car, arms raised and mouth open.",M,"L'auto aveva sterzato dalla corsia interna a quella esterna, ma il guidatore disse che Duggan era saltato davanti all'auto con le mani alzate e la bocca aperta.","L'auto ha sterzato dalla corsia interna verso l'esterno, ma l'autista ha detto che Duggan è balzato davanti all'auto, con le braccia alzate e la bocca aperta.",N/D,A,,
It is still incredible to me that he actually brought the orchestra through to the end. <sep> ,"The extensive press coverage of the incident made Monteux at age thirty-eight, truly a famous conductor.",M,"L'ampia copertura mediatica dell'incidente portò Monteux alla ribalta, a soli 38 anni, come acclamato direttore d'orchestra.","L'ampia copertura mediatica dell'incidente ha reso Monteux all'età di trentotto anni, davvero un famoso direttore d'orchestra.",M,Y,,
"According to director Nicholas Meyer, writing in his autobiography, The View from the Bridge, Saavik was dropped from the film and Valeris created when Kirstie Alley proved unwilling to reprise the role, while Leonard Nimoy, in his autobiography I Am Spock, said there were also second thoughts about casting a popular, established character as a villain. <sep> ","Saavik, however, does appear in the novelization of the film, as a recruiting officer who inspires Valeris to join Starfleet, and offers some insights on how to deal with a dual heritage.",M,"Saavik, tuttavia, è presente nella trasposizione letteraria del film, dove è un ufficiale reclutatore che spinge Valeris a unirsi alla Starfleet, dandole consigli su come convivere con una discendenza mista.","Saavik, tuttavia, appare nel romanzo del film, come un ufficiale di reclutamento che ispira Valeris ad unirsi alla Flotta Stellare, e offre alcuni spunti su come affrontare una doppia eredità.",M,Y,,
Code built a large woollen mill at Carleton Place in 1871; he was forced to close it due to financial difficulties in 1878. <sep> ,Code joined the federal Ministry of Internal Revenue as an Inspector of Weights and Measures in 1880.,M,Code si unì al ministero del reddito interno federale come Ispettore dei pesi e misure nel 1880.,Code è entrato a far parte del Ministero federale delle entrate interne come ispettore di pesi e misure nel 1880.,M,Y,,
