CONTEXT,SENTENCE,GENDER of REFERENT,BENCHMARK TRANSLATION,GOOGLE TRANSLATION,REF2,CORRESPONDENCE,,LINK ORIGINALI
"Pierpont told of entering and holding up the bank and then fleeing to Fort Wayne, where the loot was divided between him and three others. <sep>","However, Pierpont stated that Skeer was the planner of the robbery.",M,"Comunque, Pierpont disse che Skeer era il pianificatore della rapina.","Tuttavia, Pierpont ha dichiarato che Skeer era il pianificatore della rapina.",M,Y,,https://github.com/amazon-science/machine-translation-gender-eval/blob/main/data/context/geneval-context-wikiprofessions-2to1-dev.en_it.en#L52
"He delivered a paper at the First Migraine Symposium in 1966 on Migraine: from Cappadocia to Queen Square, combining his clinical interest with his love of history. <sep>","Critchley was a handsome and impressive figure, a superb speaker and a lifelong student of the human mind.",M,"Critchley era una figura impressionante e bellissima, un oratore superbo e uno eterno studente della mente umana.","Critchley era una figura bella e imponente, un superbo oratore e uno studente per tutta la vita della mente umana.",M,Y,,https://github.com/amazon-science/machine-translation-gender-eval/blob/main/data/context/geneval-context-wikiprofessions-original-dev.en_it.it
"A year later, he finally took up residence at Bourges, where he remained till his death in 1590, in spite of a handsome offer made him by pope Gregory XIII in 1584 to attract him to Bologna. <sep> ",The life of Cujas was altogether that of a scholar and teacher.,M,La vita di Cujas fu nel complesso quella di uno studioso e un insegnante.,La vita di Cujas fu tutta quella di uno studioso e di un maestro.,M,Y,,
"The year 1912 also marked Spargo's only foray into American electoral politics, when he ran for the United States Congress in the 1st Congressional District of Vermont as the nominee of the Socialist Party. <sep>","At the 1917 National Convention of the Socialist Party, Spargo was the author of a minority resolution in the Committee on War and Militarism calling for American support of the Allied war effort as the least onerous alternative facing the socialist movement.",M,"Al convegno nazionale del partito socialista del 1917, Spargo fu l'autore di una risoluzione minoritaria nella commisione sulla guerra e il militarismo, definendo il supporto americano per lo sforzo bellico congiunto come l'alternativa meno onerosa che fronteggiava il movimento socialista.","Alla Convenzione nazionale del Partito socialista del 1917, Spargo fu l'autore di una risoluzione di minoranza nel Comitato per la guerra e il militarismo che chiedeva il sostegno americano allo sforzo bellico alleato come alternativa meno onerosa per il movimento socialista.",M,Y,,
"When Birmelin retired in 1950, Buesgen was given Birmelin's post - a position he would hold for the remainder of his life. <sep>","Buesgen also actively worked as a piano, organ and voice teacher in Allentown, and served as organist and choirmaster for a number of local churches.",M,"Buesgen ha anche lavorato come professore di piano, organo e voce ad Allentown, e ha lavorato come organista e maestro di coro per diverse chiese.","Buesgen ha anche lavorato attivamente come insegnante di pianoforte, organo e canto ad Allentown, e ha lavorato come organista e maestro di coro per un certo numero di chiese locali.",M,Y,,
"Outside of Social Security, he was involved in implementation of a federal and state civil service merit system and for a policy making federal grants proportional to per capita state income. <sep>","During World War Two, Altmeyer was the secretary of the War Manpower Commission.",M,"Durante la seconda guerra mondiale, Altmeyer fu segretario della War Manpower Commission.","Durante la seconda guerra mondiale, Altmeyer era il segretario della War Manpower Commission.",M,Y,,
"However he often spent long periods at the Château de Saché, near Tours, the home of his friend Jean de Margonne, his mother's lover and father to her youngest child. <sep>",Today the chateau is a museum dedicated to the author's life.,M,"Oggi il castello è adibito a museo, dedicato alla vita dell'autore.",Oggi il castello è un museo dedicato alla vita dell'autore.,M,Y,,
"In 1957, he went to the United States to study at the University of California, Berkeley, and was a research assistant to Seymour Martin Lipset. <sep>",Etzioni is the author of over 30 books.,M,Etzioni è l'autore di oltre 30 libri.,Etzioni è autore di oltre 30 libri.,M,Y,,
Secretary of the Navy during 1962–63; he was also an Assistant Secretary of the Army in 1952–53. <sep>,Various sources cite different reasons for Secretary Korth's departure.,M,Varie fonti citano diverse motivazioni per le dimissioni del Segretario Korth.,Varie fonti citano diversi motivi per la partenza del segretario Korth.,M,Y,,
"He died in Plovdiv, Bulgaria in 1966. <sep> ",Mandzhukov is the author of several books devoted to the revolutionary struggles from 1895 to 1903.,M,Mandzhukov è autore di diversi libri dedicati ai moti rivoluzionari occorsi tra il 1895 e il 1903.,Mandzhukov è autore di diversi libri dedicati alle lotte rivoluzionarie dal 1895 al 1903.,M,Y,,
"(2018) as well as the Hulu original series, “Shrill”, as the main character’s (Aidy Bryant) father. <sep> ","Stern works as an artist, specializing in bronze sculpture.",M,Stern è un artista specializzato in sculture di bronzo.,"Stern lavora come artista, specializzato nella scultura in bronzo.",M,Y,,
"He appeared as such by his work in three volumes, published in 1835 with the title: Observations sur le projet de révision du Code pénal. <sep>",This work could not miss drawing the attention to its author.,M,Quest'opera non poteva non attirare l'attenzione sul suo autore.,Quest'opera non poteva mancare di richiamare l'attenzione sul suo autore.,M,Y,,
"The title page introduces the book as the history of King's-Place and other modern nunneries, with authorship by a monk of the Order of St Francis, and containing their [the nunneries'] mysteries, devotions and sacrifices, comprising also, the ancient and present state of promiscuous gallantry: with the portraits of the most celebrated demireps and courtezans of this period: as well as sketches of their professional and occasional admirers. <sep>",The modern nunneries the author describes are contemporary high-class brothels.,M,L'autore descrive i conventi moderni come bordelli contamporanei d'alta classe.,I moderni conventi che l'autore descrive sono bordelli contemporanei di alta classe.,M,Y,,
"Whittier was heavily influenced by the doctrines of his religion, particularly its stress on humanitarianism, compassion, and social responsibility. <sep> ",Whittier was first introduced to poetry by a teacher.,M,Whittier fu introdotto alla poesia da una sua insegnante.,Whittier è stato introdotto per la prima volta alla poesia da un insegnante.,M,Y,,
"Thereafter, in 1936, he joined the recording company His Master's Voice. <sep>","Coming back to Singapore in 1947, Zubir worked as a part-time photographer with the Utusan Melayu newspaper while composing and performing music and songs.",M,"Tornando a Singapore nel 1947, Zubir lavorò come fotografo part-time cone il giornale Utusan Melayu mentre componeva ed eseguiva musica e canzoni.","Tornato a Singapore nel 1947, Zubir ha lavorato come fotografo part-time con il quotidiano Utusan Melayu mentre componeva ed eseguiva musica e canzoni.",M,Y,,
"As the investigation wore on, Horsmanden also came to believe that a man named John Ury was responsible. <sep>",Ury had just arrived in town and had been working as a school teacher and a private tutor.,M,Ury era appena arrivato in città e lavorava come insegnante scolastico e tutor privato.,Ury era appena arrivato in città e aveva lavorato come insegnante di scuola e tutor privato.,M,Y,,
He was elected Member of Parliament for Berwick-upon-Tweed in 1951 where he served until 1973. <sep> ,Lambton was made a Parliamentary Under-Secretary of State for Defence (RAF) in 1970.,M,Lambton fu reso sottosegretario parlamentare dello stato per la difesa (RAF) nel 1970.,Lambton è stato nominato Sottosegretario di Stato parlamentare per la Difesa (RAF) nel 1970.,M,Y,,
"In this time of personal crisis, he became famous In Hamburg for scrawling and scribbling all over the city, using mailboxes, billboards, traffic signs and subway stations and leaving whenever possible his business card: Peter-Ernst Eiffe, Wandsbeker Chaussee 305, 2000 Hamburg 22, including the phone number. <sep>",Eiffe was also magically attracted by the student movement.,M,Eiffe era anche magicamente attratto dal movimento studentesco.,Eiffe è stata anche magicamente attratta dal movimento studentesco.,F,N,,
The image of a nurse depicted by the media is typically of a female being over-sexualized as well as diminished intellectually. <sep> ,The over-sexualized nurse is commonly referred to as a naughty nurse and is often seen as a sex symbol or nymphomaniac.,F,"La figura dell'infermiera ipersessualizzata è comunemente chiamata ""infermiera birichina"" ed è vista spesso come un sex symbol o dipendente dal sesso.",L'infermiera troppo sessualizzata è comunemente indicata come un'infermiera cattiva ed è spesso vista come un sex symbol o una ninfomane.,F,Y,,
"In 1970, two years after the beginning of China's Cultural Revolution, Liu was sent to Huairou, a small village in the Beijing countryside, where she lived and worked among the local villagers from 1968 to 1972. <sep>",As a student Liu's art education had strict limits; the constrained and academic style which students were forced to emulate has been likened by Liu to paint-by-numbers.,F,Come studentessa l'istruzione artistica di Liu aveva dei limiti severi; lo stile accademico e forzato che gli studenti erano obbligati ad emulare era stato apprezzato da Liu in paint-by-numbers.,"Da studente, l'educazione artistica di Liu aveva limiti severi; lo stile vincolato e accademico che gli studenti sono stati costretti a emulare è stato paragonato da Liu al dipingere con i numeri.",M,N,,
"Following Congressional passage of the amendment, Friedan advocated for ratification of the amendment in the states and supported other women's rights reforms: she founded the National Association for the Repeal of Abortion Laws but was later critical of the abortion-centered positions of many liberal feminists. <sep>","Regarded as an influential author and intellectual in the United States, Friedan remained active in politics and advocacy until the late 1990s, authoring six books.",F,"Considerata un'autrice influente e un'intellettuale negli Stati Uniti, Friedan si è spesa in ambito politico e attivistico fino alla fine degli anni '90, e ha scritto sei libri.","Considerato un influente autore e intellettuale negli Stati Uniti, Friedan è rimasto attivo in politica e nel patrocinio fino alla fine degli anni '90, scrivendo sei libri.",M,N,,
"The results of her performances, however, were another triumph for Elssler, and the temporary eclipse of Taglioni. <sep>","Taglioni, although the finer artist of the two, could not for the moment compete with the newcomer's personal fascination.",F,"Taglioni, pur essendo il più dotato tra i due artisti, al momento non poté competere con il fascino della nuova arrivata.","Taglioni, sebbene l'artista più raffinato dei due, non poteva per il momento competere con il fascino personale del nuovo arrivato.",M,N,,
"In February 2008, Vissi signed to Maple Jam Music Group for the management of the release of her upcoming Greek and English albums. <sep> ","Vissi was the most nominated artist with thirteen music videos, and managed to secure the number one position with Treno, while Agapi Ipervoliki came in at number four when the top 30 were announced.",F,"Vissi è stata l'artista con il maggior numero di video nominati (13) e si è aggiudicata la prima posizione della top 30 con Treno, mentre Agapi Ipervoliki si è attestato in quarta piazza.","Vissi è stato l'artista più nominato con tredici video musicali, ed è riuscito ad assicurarsi la prima posizione con Treno, mentre Agapi Ipervoliki è arrivato al numero quattro quando sono stati annunciati i primi 30.",M,N,,
Golding was born in Blaenau Ffestiniog in 1881 and her family then moved to Hay on Wye. <sep> ,Golding trained as a nurse.,F,Golding studiò per diventare infermiera.,Golding ha studiato come infermiera.,F,Y,,
"On November 18, 2004, she revealed on her website that she would return to music and announced that the album would be called The Emancipation of Mimi, stating, For the first time in my life, I feel free and unashamed to be who I really am, she wrote. <sep> ",I am celebrating that I've grown into a person and artist who no longer feels imprisoned by my insecurities ...,F,"Festeggio la mia crescita come persona e come artista, e il non sentirmi più prigioniera delle mie insicurezze...",Sto festeggiando di essere diventato una persona e un artista che non si sente più imprigionato dalle mie insicurezze...,M,N,,
"Anne Elwood, from her Memoirs of Literary Ladies: It was her invariable habit to write in her bed-room, – a homely-looking, almost uncomfortable room, fronting the street, and barely furnished – with a simple white bed, at the foot of which was a small, old, oblong-shaped sort of dressing-table, quite covered with a common worn writing-desk, heaped with papers, while some strewed the ground, the table being too small for aught besides the desk. <sep>","A little high-backed cane chair, which gave you any idea but that of comfort, and a few books scattered about, completed the author's paraphernalia.",F,"A completare l'atmosfera che circondava l'autrice c'era una piccola poltrona di vimini dall'ampio schienale, che sembrava tutto fuorché comoda, e alcuni volumi sparsi qua e là.","Una piccola sedia di vimini dallo schienale alto, che dava qualsiasi idea tranne quella di comodità, e alcuni libri sparsi qua e là, completavano l'armamentario dell'autore.",M,N,,
"Together, their presence in the household gave Kamaladevi a firm grounding and provided benchmarks to respect for her intellect as well as her voice, something that she came to be known for in the future. <sep>",Kamaladevi was an exceptional student and also exhibited qualities of determination and courage from an early age.,F,"Kamaladevi era una studentessa eccezionale, e sin da giovane si dimostrò molto determinata e coraggiosa.",Kamaladevi era uno studente eccezionale e fin dalla tenera età ha anche mostrato doti di determinazione e coraggio.,M,N,,
She became the first woman to be given the title of majority leader of the Kansas Senate when she was elected in 1993. <sep>,"While serving as lieutenant governor, Frahm also served as the state's Secretary of Administration.",F,"Mentre era vice-governatrice, Frahm è stata anche segretaria dell'amministrazione di Stato.","Mentre prestava servizio come luogotenente governatore, Frahm è stato anche segretario dell'amministrazione dello stato.",M,N,,
Since May 2017 she has been Professor of Holocaust Studies at Goethe University Frankfurt. <sep> ,"Steinbacher is the author of several works on the Holocaust, including Musterstadt Auschwitz: Germanisierungspolitik Und Judenmord in Ostoberschlesien (2010) and Auschwitz: A History (2005).",F,"Steinbacher è autrice di diversi lavori sull'Olocausto, tra cui Musterstadt Auschwitz: Germanisierungspolitik Und Judenmord in Ostoberschlesien (2010) e Auschwitz: A History (2005).","Steinbacher è autore di diverse opere sull'Olocausto, tra cui Musterstadt Auschwitz: Germanisierungspolitik Und Judenmord in Ostoberschlesien (2010) e Auschwitz: A History (2005).",M,N,,
She can also apparently release a blast of paralytic energy through physical contact without any visible effect. <sep> ,The Asp is also an accomplished dancer with superb muscular control.,F,Asp è anche un'abile ballerina e possiede un eccellente controllo muscolare.,L'Asp è anche un abile ballerino con un superbo controllo muscolare.,M,N,,
"According to Moira Ferguson, the history of surnames for this period suggest that her surname was probably derived from the Anglicized French Anjou,. <sep>","Anger, whose poem on the author appears at the end of the volume, was a relative or spouse.",F,"Anger, la cui poesia dedicata all'autore appare alla fine del volume, era una sua parente o coniuge.","La rabbia, la cui poesia sull'autore appare alla fine del volume, era un parente o un coniuge.",M,N,,
"Settling in Utica, New York, her father became a traveling salesman. <sep> ",Mengers entered the talent agency business in 1955 as a receptionist at MCA.,F,"Mengers è entrata nel business delle agenzie di talenti nel 1955, quando divenne receptionist per la MCA.",Mengers è entrato nel business dell'agenzia di talenti nel 1955 come receptionist presso MCA.,M,N,,
I imagine she immediately dashed off a biography of Harry after he defeated Voldemort. <sep>,It has been speculated that the fraught relationship between Rowling and the press was the inspiration for the author to develop the character.,F,Sembra che sia stato il rapporto conflittuale tra Rowling e la stampa a ispirare l'autrice a sviluppare questo personaggio.,È stato ipotizzato che il rapporto teso tra Rowling e la stampa sia stato l'ispirazione per l'autore per sviluppare il personaggio.,M,N,,
"When performed by a female artist, these types of stunts sometimes involve aspects of the damsel in distress archetype, although with the damsel rescuing herself rather than waiting for a hero to come to her aid. <sep> ",The artist uses illusion techniques to re-appear unharmed.,F,L'artista si serve di illusioni ottiche per ricomparire sana e salva.,L'artista utilizza tecniche di illusione per riapparire illeso.,M,N,,
"She was born Charlotte Louise Kingdon, the daughter of John Clarence Kingdon and Elsie Wilmot, and was educated at Minnedosa Collegiate, the Manitoba Provincial Normal School and Brandon College. <sep> ","Prior to running for political office, Oleson raised three children and worked as librarian for the town of Glenboro and later for Glenboro Collegiate.",F,"Prima di entrare in politica, Oleson ha cresciuto tre figli e ha lavorato come bibliotecaria prima per il municipio di Glenboro e poi per il liceo della medesima città.","Prima di candidarsi a una carica politica, Oleson ha cresciuto tre figli e ha lavorato come bibliotecario per la città di Glenboro e successivamente per la Glenboro Collegiate.",M,N,,
"This depiction of her likely caused some critics to perceive her simply as a young, decorative model who was working with an older established male painter. <sep> ",Gonzalès was Manet's only formal student and also modeled for several members of the Impressionist school.,F,Gonzalès fu l'unica allieva ufficiale di Manet e ha anche fatto da modella per diversi esponenti della scuola impressionista.,Gonzalès era l'unico allievo formale di Manet e fece anche da modello per diversi membri della scuola impressionista.,M,N,,
"In both letters she quotes from such classical figures as Aristotle and Tacitus, and she draws from various Greek and Roman myths. <sep> ","Speght's was the first of three responses to Swetnam's tract, and was the only one published under the author's actual name.",F,"Quella di Speght è stata la prima di tre risposte al libello di Swetnam, e l'unica pubblicata con il vero nome dell'autrice.","Quella di Speght è stata la prima di tre risposte al volantino di Swetnam, ed è stata l'unica pubblicata con il vero nome dell'autore.",M,N,,
"She was a student of Chinese art, literature, and sociology. <sep> ","Ayscough was a lecturer on Chinese art and literature and was the author of eight books on Chinese history, culture, literary criticism and translation.",F,"Ayscough è stata docente di arte e letteratura cinese, e autrice di otto volumi riguardanti storia, cultura, critica letteraria e traduzione cinese.","Ayscough era un docente di arte e letteratura cinese ed è stato autore di otto libri di storia, cultura, critica letteraria e traduzione cinesi.",M,N,,
"After a series of miscarriages, she underwent surgery to remove a fibroid tumor. <sep> ","Although still weak from surgery, Glaspell worked with Cook and friends to start an experimental theatre company, a creative collective.",F,"Sebbene ancora debilitata dall'operazione, Glaspell lavorò con Cook e altri amici alla creazione di una compagnia di teatro sperimentale, un collettivo creativo.","Sebbene ancora debole per l'intervento chirurgico, Glaspell ha lavorato con Cook e amici per avviare una compagnia teatrale sperimentale, un collettivo creativo.",N/D,A,,
"After coming in second in a Japanese music competition in 1984, Ogawa attained third prize in the 1987 Leeds International Piano Competition, which launched her international performing career. <sep> ",Since 1997 Ogawa has been an exclusive recording artist for BIS Records.,F,Dal 1997 Ogawa è passata in modo esclusivo sotto la BIS Records.,Dal 1997 Ogawa è un artista discografico esclusivo per la BIS Records.,M,N,,
"Maria Lea Carmen Imutan Salonga, OL, (/ˈleɪə səˈlɒŋɡə/; born February 22, 1971) is a Filipina singer and actress, best known for her roles in musical theatre, for supplying the singing voices of two Disney Princesses (Jasmine and Mulan), and as a recording artist and television performer. <sep> ",Salonga is the first Filipino artist to sign with an international record label (Atlantic Records in 1993).,F,Salonga è la prima artista filippina a firmare con una casa discografica internazionale (la Atlantic Records nel 1993).,Salonga è il primo artista filippino a firmare con un'etichetta discografica internazionale (Atlantic Records nel 1993).,M,N,,
"In the 2006 election, she again faced off against Wallace, losing to him by 2,570 votes. <sep> ",Torsney was the Parliamentary Secretary to the Minister of the Environment from 1998 to 2000.,F,Torsney fu Segretaria Parlamentare del Ministero dell'Ambiente dal 1998 al 2000.,Torsney è stato segretario parlamentare del ministro dell'Ambiente dal 1998 al 2000.,M,N,,
"She had another affair with a local man during a stay with her daughters in Samoa in 1989; when she returned she discovered Pat was also having an affair, which she accepted. <sep> ","A prolific artist, Bewick paints in oil, sculpts, and works with cloth, but is most associated with watercolours.",F,"Artista prolifica, Bewick realizza dipinti a olio, sculture e opere in tessuto, ma è principalmente conosciuta per i suoi acquerelli.","Un artista prolifico, Bewick dipinge a olio, scolpisce e lavora con la stoffa, ma è più associato agli acquerelli.",M,N,,
"T. Rogers, is a widely praised dramatization of the previously unheralded role of Juul and her husband, and others, in developing the back-channel communications that (reportedly) saved the Oslo negotiations from collapsing. <sep> ","During the first cabinet Stoltenberg, from 2000 to 2001, Juul was appointed State Secretary in the Ministry of Foreign Affairs.",F,"Dal 2000 al 2001, durante il primo governo Stoltenberg, Juul fu nominata Segretaria di Stato per il Ministero degli Affari Esteri.","Durante il primo gabinetto Stoltenberg, dal 2000 al 2001, Juul è stato nominato Segretario di Stato al Ministero degli Affari Esteri.",M,N,,
A selection of the most prominent exhibitions includes: NMWA hosts educational programs for all age groups to teach the public about the artistic accomplishments of women. <sep> ,Member days include curator- and artist-led tours.,F,Le giornate dedicate ai membri includono visite guidate dai curatori e dalle artiste.,I giorni dei membri includono tour guidati da curatori e artisti.,M,N,,
"She is a divorced single mother with two children who lives in Pont-de-l’Arche, Normandy. <sep> ",Levavasseur is a trained nurse's aide.,F,Levavasseur ha studiato come aiuto infermiera.,Levavasseur è un'infermiera qualificata.,F,Y,,
"Continuing to throw after the 1980 Olympics, she set the masters world record in the W35 division that has stood since 1980. <sep> ",Melnik graduated from the Moscow State University of Medicine and Dentistry and later worked as a dentist and athletics coach in Moscow.,F,"Melnik si è laureata presso l'Università statale di Medicina e Odontoiatria di Mosca, dove ha poi lavorato come dentista e coach di atletica.",Melnik si è laureato presso l'Università statale di medicina e odontoiatria di Mosca e in seguito ha lavorato come dentista e allenatore di atletica leggera a Mosca.,M,N,,
Her musical influences range from ragtime to folk to trip-hop and everything in between. <sep> ,"Nalick did perform in 2005 on The Tonight Show, making sure to invite the teacher to the audience.",F,"Nel 2005, Nalick si è poi esibita al The Tonight Show, assicurandosi di invitare il suo professore ad assistere tra il pubblico.","Nalick si è esibito nel 2005 al The Tonight Show, assicurandosi di invitare l'insegnante al pubblico.",M,N,,
"Brava was offered a recording contract by EMI in 1997, and she worked under the EMI Classics label from 1998 to 2002. <sep> ","The album peaked at number 14 on the UK Classical Chart, and Brava became the biggest selling Finnish classical artist at the time.",F,"L'album si spinse fino alla quattordicesima posizione della UK Classical Chart, e Brava diventò l'artista classica finlandese più di successo del periodo.",L'album raggiunse la posizione numero 14 nella UK Classical Chart e Brava divenne l'artista classico finlandese più venduto all'epoca.,M,N,,
